{
  "schema": "ph-boundary-lumen-authoring-report.v1",
  "schemaVersion": "1",
  "task": "TASK-A09",
  "recordedAt": "2026-09-10",
  "coordinateSpace": {
    "kind": "source-image-stack",
    "patientSpaceClaim": false,
    "ctRegistrationEstablished": false
  },
  "structures": [
    {
      "draftLabel": "radial_artery",
      "anatomicalId": "structure.radial_artery.left",
      "representationStatus": "blocked",
      "outsideRegion": null,
      "wallBoundary": null,
      "lumenRegion": null,
      "reason": "TASK-AS06 extended the same-subject reviewed ulnar anchor through the proximal radius/ulna transition and tested eight anonymous arterial tracks, but zero met the fixed branch-topology promotion gate. No accepted radial segmentation/lumen mask exists, so outside/wall/lumen representation remains blocked."
    },
    {
      "draftLabel": "ulnar_artery",
      "anatomicalId": "structure.ulnar_artery.left",
      "representationStatus": "generated",
      "outsideRegion": "drive://10DxqbYQbiNUV_JIvqpCxQxLLMwUmJxmQ#outside=source-crop-complement-of-lumen",
      "wallBoundary": "drive://10DxqbYQbiNUV_JIvqpCxQxLLMwUmJxmQ#boundary/ulnar_artery",
      "lumenRegion": "drive://10DxqbYQbiNUV_JIvqpCxQxLLMwUmJxmQ#lumen/ulnar_artery",
      "reason": "The bounded 106-frame V0/source-stack ulnar artery lumen candidate accepted unchanged by TASK-A06 human review remains valid. TASK-AS06 strengthens proximal same-subject continuity evidence without changing this bounded topology representation or creating any anatomical wall-thickness, complete-vessel-extent, Patient Space, TASK-A12 anatomical-review, or medical-validation claim."
    },
    {
      "draftLabel": "superficial_target_vein",
      "anatomicalId": null,
      "representationStatus": "blocked",
      "outsideRegion": null,
      "wallBoundary": null,
      "lumenRegion": null,
      "reason": "TASK-AS06 tested eight anonymous superficial tracks over a wider same-subject extent, but zero met the fixed continuity gate. No accepted superficial target-vein segmentation/lumen mask or named anatomical identity exists, so outside/wall/lumen representation remains blocked."
    }
  ],
  "claims": {
    "boundaryLumenRepresentationsCreated": true,
    "patientSpaceGeometry": false,
    "medicalValidation": false,
    "automaticPromotionAllowed": false
  }
}
